name,url,description,stars
HiiARA/SoPI,https://github.com/HiiARA/SoPI,SoPI (Software Post Install) Software para descargar/instalar después de una instalación de Windows 7/10/11),10,Uncategorized
ardyan69/wa,https://github.com/ardyan69/wa,Whatsapp Blasting with TagUI,13,Desktop & UI Customization & Tweaks
wizz13150/PDQ_Repo,https://github.com/wizz13150/PDQ_Repo,"PDQ Deploy Scripts, Tools, Utilities ... For IT daily Administration",85,Development & Scripting Tools
aliounebfam/vscode_projects_launcher,https://github.com/aliounebfam/vscode_projects_launcher,Scripts pour démarrer plusieurs projets VSCode à partir d'un répertoire principal. | Scripts to launch multiple VSCode projects from a main directory.,12,Development & Scripting Tools
ancel1x/Ancels-Performance-Batch,https://github.com/ancel1x/Ancels-Performance-Batch,Open Source Tweaker made to improve system performance and lower system latency.,239,System Tweaks & Performance Enhancements
Batlez/Batlez-Tweaks,https://github.com/Batlez/Batlez-Tweaks,"Batlez Tweaks is a batch tweaking script that optimizes your system to provide the best gaming experience possible. It is free and open-source, and works on Windows 10 & 11!",129,System Tweaks & Performance Enhancements
tcja/Windows-10-tweaks,https://github.com/tcja/Windows-10-tweaks,This repo contains multiple scripts to optimize windows 10,50,System Tweaks & Performance Enhancements
warengonzaga/wrn-cleaner,https://github.com/warengonzaga/wrn-cleaner,A free maintenance tool that can automatically or manually clean up your Windows machine in a simple and reliable way. 😉💻🧹,99,Uncategorized
ddashizzle/snapraid_made_simple,https://github.com/ddashizzle/snapraid_made_simple,Batch script to simply maintenance and notification of SnapRAID for Windows 10 and adjacent versions.  ,10,Development & Scripting Tools
AhmetHan/EDR_Tester,https://github.com/AhmetHan/EDR_Tester,This batch script file wants to check your EDR systems detection and response capabilities in a more noisy way!,11,System Information & Diagnostics
fr0st-iwnl/WinConfigs,https://github.com/fr0st-iwnl/WinConfigs,⚙️ \\ A script to simplify Windows setup by automating software installation and system tweaks. [❗Check README❗],29,System Tweaks & Performance Enhancements
Ec-25/FixIt,https://github.com/Ec-25/FixIt,A simple Script capable of optimizing and repairing almost any error that may occur on your Windows computer,84,Development & Scripting Tools
NARCOTIC/Windows-Optimizer,https://github.com/NARCOTIC/Windows-Optimizer,Windows-Optimizer is a batch program. This program is Optimizing and Defragmenting All Connected Storage Drives & Fixing File System Errors.,24,System Tweaks & Performance Enhancements
PAXANDDOS/ForzaHorizonFix,https://github.com/PAXANDDOS/ForzaHorizonFix,A simple fix for Forza Horizon 4 and Forza Horizon 5 crashes,35,Logging & Event Analysis
t4rra/hotspot-helper,https://github.com/t4rra/hotspot-helper,Fixes the lag spikes caused by windows hotspot when using wireless Virtual Reality streaming apps.,31,Uncategorized
n00mkrad/ffmpeg-batch-utils,https://github.com/n00mkrad/ffmpeg-batch-utils,Useful batch scripts for videos. Originally made as a toolbox for use with upscaling neural networks.,12,Network & Internet Tools
szybnev/TTL-Changer,https://github.com/szybnev/TTL-Changer,Script to change TTL on Windows,13,Development & Scripting Tools
Scrut1ny/Windows-Debloating-Script,https://github.com/Scrut1ny/Windows-Debloating-Script,"Ultimate Windows tweaking guide for best performance, privacy, & security!",42,System Tweaks & Performance Enhancements
Batlez/Batlez-Tweaks,https://github.com/Batlez/Batlez-Tweaks,"Batlez Tweaks is a batch tweaking script that optimizes your system to provide the best gaming experience possible. It is free and open-source, and works on Windows 10 & 11!",129,System Tweaks & Performance Enhancements
